latitude,longitude,business_name,street_address,zip,NAICS_2017_6digit_code,NAICS_2017_6digit_desc,NAICS_2017_2digit_code,NAICS_2017_2digit_desc,estimated_employment,employment_buckets,mainstreet,geometry,district,index_right,DISTRICT
42.322974,-71.104634,zarash llc,319 Centre St,2130,452319,All Other General Merchandise Stores,45,Retail Trade,0.0,Not Available,Three Squares,POINT (-71.104634 42.322974),,5,6
42.322755,-71.103061,young kong restauranrt,300 Centre St,2130,722511,Full-Service Restaurants,72,Accommodation and Food Services,4.0,1 to 9,Three Squares,POINT (-71.103061 42.322755),,5,6
42.32136,-71.11089,whole foods market,413 Centre St,2130,445110,Supermarkets and Other Grocery (except Convenience) Stores,44,Retail Trade,150.0,100+,Three Squares,POINT (-71.11089 42.32136),,5,6
42.323,-71.1032,western union agent location,301 Centre St,2130,522320,"Financial Transactions Processing, Reserve, and Clearinghouse Activities",52,Finance and Insurance,2.0,1 to 9,Three Squares,POINT (-71.1032 42.323),,5,6
42.320656,-71.111128,"volunteers of america, inc",441 Centre St,2130,624190,Other Individual and Family Services,62,Healthcare and Social Assistance,10.0,10 to 24,Three Squares,POINT (-71.111128 42.320656),,5,6
42.320656,-71.111128,"volunteers of america of massachusetts, inc",441 Centre St,2130,0,,99,Undefined,0.0,Not Available,Three Squares,POINT (-71.111128 42.320656),,5,6
42.320656,-71.111128,voa somerville vet housing,441 Centre St,2130,813410,Civic and Social Organizations,81,Other Services,3.0,1 to 9,Three Squares,POINT (-71.111128 42.320656),,5,6
42.320656,-71.111128,voa malden manager inc,441 Centre St,2130,0,,99,Undefined,0.0,Not Available,Three Squares,POINT (-71.111128 42.320656),,5,6
42.321955,-71.109278,vesse 1,378 Centre St,2130,512110,Motion Picture and Video Production,51,Information,3.0,1 to 9,Three Squares,POINT (-71.109278 42.321955),,5,6
42.322207,-71.108393,vecina beauty supply,364 Centre St,2130,446120,"Cosmetics, Beauty Supplies, and Perfume Stores",44,Retail Trade,2.0,1 to 9,Three Squares,POINT (-71.108393 42.322207),,5,6
42.322199,-71.107796,vasallo's mens fashions,362 Centre St,2130,448140,Family Clothing Stores,44,Retail Trade,1.0,1 to 9,Three Squares,POINT (-71.107796 42.322199),,5,6
42.322782,-71.102675,ups access point location,298 Centre St,2130,541860,Direct Mail Advertising,54,"Professional, Scientific, and Technical Services",13.0,10 to 24,Three Squares,POINT (-71.102675 42.322782),,5,6
42.32235,-71.105101,united baptist church,322 Centre St,2130,813110,Religious Organizations,81,Other Services,1.0,1 to 9,Three Squares,POINT (-71.105101 42.32235),,5,6
42.321766,-71.110291,ultra beauty salon,401 Centre St,2130,812112,Beauty Salons,81,Other Services,4.0,1 to 9,Three Squares,POINT (-71.110291 42.321766),,5,6
42.323055,-71.102317,tree of life,295 Centre St,2130,621999,All Other Miscellaneous Ambulatory Health Care Services,62,Healthcare and Social Assistance,2.0,1 to 9,Three Squares,POINT (-71.102317 42.323055),,5,6
42.323252,-71.103616,the threading place,315 Centre St,2130,812112,Beauty Salons,81,Other Services,3.0,1 to 9,Three Squares,POINT (-71.103616 42.323252),,5,6
42.321667,-71.110389,the haven,2 Perkins St,2130,722511,Full-Service Restaurants,72,Accommodation and Food Services,8.0,1 to 9,Three Squares,POINT (-71.110389 42.321667),,5,6
42.32266,-71.108252,the frogmore,365 Centre St,2130,722511,Full-Service Restaurants,72,Accommodation and Food Services,8.0,1 to 9,Three Squares,POINT (-71.108252 42.32266),,5,6
42.322199,-71.107796,tara construction,362 Centre St,2130,236115,New Single-Family Housing Construction (except For-Sale Builders),23,Construction,5.0,1 to 9,Three Squares,POINT (-71.107796 42.322199),,5,6
42.322354,-71.109438,tails inc,385 Centre St,2130,0,,99,Undefined,0.0,Not Available,Three Squares,POINT (-71.109438 42.322354),,5,6
42.321955,-71.109278,tails,380 Centre St,2130,812910,Pet Care (except Veterinary) Services,81,Other Services,11.0,10 to 24,Three Squares,POINT (-71.109278 42.321955),,5,6
42.323252,-71.103616,t-mobile,315 Centre St,2130,517312,Wireless Telecommunications Carriers (except Satellite),51,Information,9.0,1 to 9,Three Squares,POINT (-71.103616 42.323252),,5,6
42.323,-71.1032,stop & shop supermarket,301 Centre St,2130,445110,Supermarkets and Other Grocery (except Convenience) Stores,44,Retail Trade,100.0,100+,Three Squares,POINT (-71.1032 42.323),,5,6
42.323,-71.1032,stop & shop pharmacy,301 Centre St,2130,446110,Pharmacies and Drug Stores,44,Retail Trade,5.0,1 to 9,Three Squares,POINT (-71.1032 42.323),,5,6
42.322974,-71.104634,spinal rehab group-dorchester,329 Centre St,2130,621310,Offices of Chiropractors,62,Healthcare and Social Assistance,3.0,1 to 9,Three Squares,POINT (-71.104634 42.322974),,5,6
42.322974,-71.104634,spinal rehab group llc,329 Centre St,2130,621399,Offices of All Other Miscellaneous Health Practitioners,62,Healthcare and Social Assistance,3.0,1 to 9,Three Squares,POINT (-71.104634 42.322974),,5,6
42.323055,-71.102317,spanish immersion jamaica plain,295 Centre St,2130,0,,99,Undefined,0.0,Not Available,Three Squares,POINT (-71.102317 42.323055),,5,6
42.322626,-71.104041,sophia beauty salon,314 Centre St,2130,812112,Beauty Salons,81,Other Services,3.0,1 to 9,Three Squares,POINT (-71.104041 42.322626),,5,6
42.324131,-71.100935,smart from the start,960 Parker St,2130,624190,Other Individual and Family Services,62,Healthcare and Social Assistance,9.0,1 to 9,Three Squares,POINT (-71.100935 42.324131),,5,6
42.32279,-71.10645,rizzo's pizza,347 Centre St,2130,722511,Full-Service Restaurants,72,Accommodation and Food Services,2.0,1 to 9,Three Squares,POINT (-71.10645 42.32279),,5,6
42.319699,-71.111126,river of life church,440 Centre St,2130,813110,Religious Organizations,81,Other Services,2.0,1 to 9,Three Squares,POINT (-71.111126 42.319699),,5,6
42.322851,-71.105699,reyna services llc,339 Centre St,2130,541213,Tax Preparation Services,54,"Professional, Scientific, and Technical Services",1.0,1 to 9,Three Squares,POINT (-71.105699 42.322851),,5,6
42.323252,-71.103616,rainbow,315 Centre St,2130,448120,Women's Clothing Stores,44,Retail Trade,11.0,10 to 24,Three Squares,POINT (-71.103616 42.323252),,5,6
42.323553,-71.102017,queen marlene inc,90 Bickford St,2130,813319,Other Social Advocacy Organizations,81,Other Services,9.0,1 to 9,Three Squares,POINT (-71.102017 42.323553),,5,6
42.322631,-71.101096,professional multi services,270 Centre St,2130,541990,"All Other Professional, Scientific, and Technical Services",54,"Professional, Scientific, and Technical Services",1.0,1 to 9,Three Squares,POINT (-71.101096 42.322631),,5,6
42.323189,-71.100701,prevost group,265 Centre St,2130,541618,Other Management Consulting Services,54,"Professional, Scientific, and Technical Services",7.0,1 to 9,Three Squares,POINT (-71.100701 42.323189),,5,6
42.323677,-71.100662,positive approaches counseling & multi-services center,964 Parker St,2130,624110,Child and Youth Services,62,Healthcare and Social Assistance,6.0,1 to 9,Three Squares,POINT (-71.100662 42.323677),,5,6
42.322199,-71.107796,pixel pyramid,362 Centre St,2130,0,,99,Undefined,0.0,Not Available,Three Squares,POINT (-71.107796 42.322199),,5,6
42.322411,-71.106552,pimentel market,340 Centre St,2130,445110,Supermarkets and Other Grocery (except Convenience) Stores,44,Retail Trade,2.0,1 to 9,Three Squares,POINT (-71.106552 42.322411),,5,6
42.321955,-71.109278,pikalo,378 Centre St,2130,0,,99,Undefined,0.0,Not Available,Three Squares,POINT (-71.109278 42.321955),,5,6
42.32136,-71.11089,pico,413 Centre St,2130,722511,Full-Service Restaurants,72,Accommodation and Food Services,140.0,100+,Three Squares,POINT (-71.11089 42.32136),,5,6
42.323073,-71.1076,peak performance chiro rehab,363 Centre St,2130,621310,Offices of Chiropractors,62,Healthcare and Social Assistance,3.0,1 to 9,Three Squares,POINT (-71.1076 42.323073),,5,6
42.320339,-71.111472,paulmino inc,451 Centre St,2130,447190,Other Gasoline Stations,44,Retail Trade,10.0,10 to 24,Three Squares,POINT (-71.111472 42.320339),,5,6
42.323677,-71.100662,paramount builders counseling,964 Parker St,2130,624110,Child and Youth Services,62,Healthcare and Social Assistance,6.0,1 to 9,Three Squares,POINT (-71.100662 42.323677),,5,6
42.322658,-71.106728,old havana,349 Centre St,2130,722511,Full-Service Restaurants,72,Accommodation and Food Services,8.0,1 to 9,Three Squares,POINT (-71.106728 42.322658),,5,6
42.323677,-71.100662,nine sixty four collaborative,964 Parker St,2130,0,,99,Undefined,0.0,Not Available,Three Squares,POINT (-71.100662 42.323677),,5,6
42.322974,-71.104634,multi-cultural independent,329 Centre St,2130,813311,Human Rights Organizations,81,Other Services,10.0,10 to 24,Three Squares,POINT (-71.104634 42.322974),,5,6
42.322535,-71.108644,moneshan salon & spa,371 Centre St,2130,812112,Beauty Salons,81,Other Services,3.0,1 to 9,Three Squares,POINT (-71.108644 42.322535),,5,6
42.322354,-71.109438,monarca ventures inc,385 Centre St,2130,0,,99,Undefined,0.0,Not Available,Three Squares,POINT (-71.109438 42.322354),,5,6
42.322379,-71.109271,miami restaurant,381 Centre St,2130,722511,Full-Service Restaurants,72,Accommodation and Food Services,5.0,1 to 9,Three Squares,POINT (-71.109271 42.322379),,5,6
42.321955,-71.109278,massive restaurant group inc,378 Centre St,2130,722511,Full-Service Restaurants,72,Accommodation and Food Services,8.0,1 to 9,Three Squares,POINT (-71.109278 42.321955),,5,6
42.322095,-71.108729,massacusettes republican party victory committee,370 Centre St,2130,813940,Political Organizations,81,Other Services,3.0,1 to 9,Three Squares,POINT (-71.108729 42.322095),,5,6
42.323553,-71.102017,marlowe cab inc,90 Bickford St,2130,485310,Taxi Service,48,Transportation and Warehosuing,12.0,10 to 24,Three Squares,POINT (-71.102017 42.323553),,5,6
42.321643,-71.109678,mark w miller law offices,390 Centre St,2130,541110,Offices of Lawyers,54,"Professional, Scientific, and Technical Services",4.0,1 to 9,Three Squares,POINT (-71.109678 42.321643),,5,6
42.322255,-71.107526,lucy parsons center,358 Centre St,2130,451211,Book Stores,45,Retail Trade,20.0,10 to 24,Three Squares,POINT (-71.107526 42.322255),,5,6
42.322319,-71.107079,local logistics,348 Centre St,2130,541611,Administrative Management and General Management Consulting Services,54,"Professional, Scientific, and Technical Services",12.0,10 to 24,Three Squares,POINT (-71.107079 42.322319),,5,6
42.321769,-71.109528,law offices of paul j sweeney,386 Centre St,2130,541110,Offices of Lawyers,54,"Professional, Scientific, and Technical Services",3.0,1 to 9,Three Squares,POINT (-71.109528 42.321769),,5,6
42.322755,-71.103061,latino restaurant-ma,302 Centre St,2130,722511,Full-Service Restaurants,72,Accommodation and Food Services,5.0,1 to 9,Three Squares,POINT (-71.103061 42.322755),,5,6
42.322742,-71.106887,latin djs entertainment,351 Centre St,2130,711190,Other Performing Arts Companies,71,"Arts, Entertainment, and Recreation",7.0,1 to 9,Three Squares,POINT (-71.106887 42.322742),,5,6
42.322804,-71.106298,la nacional corp,345 Centre St,2130,561510,Travel Agencies,56,"Adminstrative, Support, Waste Management, and Remediation Services",2.0,1 to 9,Three Squares,POINT (-71.106298 42.322804),,5,6
42.322878,-71.10504,l & c bakery corp,333 Centre St,2130,311811,Retail Bakeries,31,Manufacturing,6.0,1 to 9,Three Squares,POINT (-71.10504 42.322878),,5,6
42.323073,-71.1076,karvare inc,363 Centre St,2130,0,,99,Undefined,0.0,Not Available,Three Squares,POINT (-71.1076 42.323073),,5,6
42.322199,-71.107796,kadampa meditation center boston,360 Centre St,2130,813110,Religious Organizations,81,Other Services,3.0,1 to 9,Three Squares,POINT (-71.107796 42.322199),,5,6
42.322199,-71.107796,julie nails,360 Centre St,2130,812113,Nail Salons,81,Other Services,1.0,1 to 9,Three Squares,POINT (-71.107796 42.322199),,5,6
42.322974,-71.104634,jps massage therapy center,329 Centre St,2130,812199,Other Personal Care Services,81,Other Services,3.0,1 to 9,Three Squares,POINT (-71.104634 42.322974),,5,6
42.322199,-71.107796,jp furniture & bedding,360 Centre St,2130,442110,Furniture Stores,44,Retail Trade,3.0,1 to 9,Three Squares,POINT (-71.107796 42.322199),,5,6
42.320853,-71.110899,jp auto services,429 Centre St,2130,811111,General Automotive Repair,81,Other Services,2.0,1 to 9,Three Squares,POINT (-71.110899 42.320853),,5,6
42.322572,-71.108866,jobs with justice,375 Centre St,2130,813930,Labor Unions and Similar Labor Organizations,81,Other Services,4.0,1 to 9,Three Squares,POINT (-71.108866 42.322572),,5,6
42.322742,-71.106887,jimenez productions,351 Centre St,2130,0,,99,Undefined,0.0,Not Available,Three Squares,POINT (-71.106887 42.322742),,5,6
42.322727,-71.102695,jic corp,296B Centre St,2130,0,,99,Undefined,0.0,Not Available,Three Squares,POINT (-71.102695 42.322727),,5,6
42.322759,-71.102674,jerizon barbershop,4 Estrella St,2130,812111,Barber Shops,81,Other Services,2.0,1 to 9,Three Squares,POINT (-71.102674 42.322759),,5,6
42.322768,-71.102046,jelly coffee shop,284 Centre St,2130,722515,Snack and Nonalcoholic Beverage Bars,72,Accommodation and Food Services,5.0,1 to 9,Three Squares,POINT (-71.102046 42.322768),,5,6
42.320747,-71.110308,jamaica plain laundry center,410 Centre St,2130,812320,Drycleaning and Laundry Services (except Coin-Operated),81,Other Services,2.0,1 to 9,Three Squares,POINT (-71.110308 42.320747),,5,6
42.323898,-71.1007,jamaica plain early care-educ,962 Parker St,2130,624410,Child Day Care Services,62,Healthcare and Social Assistance,15.0,10 to 24,Three Squares,POINT (-71.1007 42.323898),,5,6
42.322572,-71.108866,"jamaica plain arts & civic center, inc",375 Centre St,2130,712110,Museums,71,"Arts, Entertainment, and Recreation",3.0,1 to 9,Three Squares,POINT (-71.108866 42.322572),,5,6
42.322411,-71.106552,jall appliance repair,340 Centre St,2130,811412,Appliance Repair and Maintenance,81,Other Services,1.0,1 to 9,Three Squares,POINT (-71.106552 42.322411),,5,6
42.322631,-71.101096,jackson square laundromat,270 Centre St,2130,812310,Coin-Operated Laundries and Drycleaners,81,Other Services,2.0,1 to 9,Three Squares,POINT (-71.101096 42.322631),,5,6
42.322676,-71.100887,il panino cafe & grill,268 Centre St,2130,722511,Full-Service Restaurants,72,Accommodation and Food Services,3.0,1 to 9,Three Squares,POINT (-71.100887 42.322676),,5,6
42.322344,-71.106904,ignite fitness development inc,342 Centre St,2130,812191,Diet and Weight Reducing Centers,81,Other Services,3.0,1 to 9,Three Squares,POINT (-71.106904 42.322344),,5,6
42.322682,-71.102445,iglesia de dios pentecostal corp benjamin,290 Centre St,2130,813110,Religious Organizations,81,Other Services,2.0,1 to 9,Three Squares,POINT (-71.102445 42.322682),,5,6
42.322572,-71.108866,hyde square task force,375 Centre St,2130,813910,Business Associations,81,Other Services,18.0,10 to 24,Three Squares,POINT (-71.108866 42.322572),,5,6
42.323536,-71.107483,hyde square task force,30 Sunnyside St,2130,624190,Other Individual and Family Services,62,Healthcare and Social Assistance,10.0,10 to 24,Three Squares,POINT (-71.107483 42.323536),,5,6
42.322273,-71.109642,hyde sq wine & liquor co,391 Centre St,2130,445310,"Beer, Wine, and Liquor Stores",44,Retail Trade,5.0,1 to 9,Three Squares,POINT (-71.109642 42.322273),,5,6
42.322974,-71.104634,hyde jackson square main st,329 Centre St,2130,813910,Business Associations,81,Other Services,1.0,1 to 9,Three Squares,POINT (-71.104634 42.322974),,5,6
42.322974,-71.104634,home basix inc,325 Centre St,2130,0,,99,Undefined,0.0,Not Available,Three Squares,POINT (-71.104634 42.322974),,5,6
42.322199,-71.107796,hello multiservices ii,362 Centre St,2130,541990,"All Other Professional, Scientific, and Technical Services",54,"Professional, Scientific, and Technical Services",3.0,1 to 9,Three Squares,POINT (-71.107796 42.322199),,5,6
42.322757,-71.108195,gutierez apartment,11 Creighton St,2130,531110,Lessors of Residential Buildings and Dwellings,53,Real Estate Rental and Leasing,5.0,1 to 9,Three Squares,POINT (-71.108195 42.322757),,5,6
42.320471,-71.110485,guardian healthcare llc,418 Centre St,2130,0,,99,Undefined,0.0,Not Available,Three Squares,POINT (-71.110485 42.320471),,5,6
42.3204,-71.11066,green street massage,420 Centre St,2130,812199,Other Personal Care Services,81,Other Services,2.0,1 to 9,Three Squares,POINT (-71.11066 42.3204),,5,6
42.322878,-71.10504,gondres bakery,333 Centre St,2130,311811,Retail Bakeries,31,Manufacturing,3.0,1 to 9,Three Squares,POINT (-71.10504 42.322878),,5,6
42.322676,-71.100887,gails cafe & grill,268 Centre St,2130,722511,Full-Service Restaurants,72,Accommodation and Food Services,10.0,10 to 24,Three Squares,POINT (-71.100887 42.322676),,5,6
42.323252,-71.103616,frugal furniture,315 Centre St,2130,442110,Furniture Stores,44,Retail Trade,3.0,1 to 9,Three Squares,POINT (-71.103616 42.323252),,5,6
42.322755,-71.103061,freddy's market,302 Centre St,2130,445110,Supermarkets and Other Grocery (except Convenience) Stores,44,Retail Trade,3.0,1 to 9,Three Squares,POINT (-71.103061 42.322755),,5,6
42.322217,-71.1097,food wall chinese restaurant,387 Centre St,2130,722511,Full-Service Restaurants,72,Accommodation and Food Services,8.0,1 to 9,Three Squares,POINT (-71.1097 42.322217),,5,6
42.322804,-71.106298,fidias troncoso service,345 Centre St,2130,541990,"All Other Professional, Scientific, and Technical Services",54,"Professional, Scientific, and Technical Services",3.0,1 to 9,Three Squares,POINT (-71.106298 42.322804),,5,6
42.322199,-71.107796,fernandez travel agency,360A Centre St,2130,561510,Travel Agencies,56,"Adminstrative, Support, Waste Management, and Remediation Services",3.0,1 to 9,Three Squares,POINT (-71.107796 42.322199),,5,6
42.322657,-71.101572,fernandez family liquor inc,280 Centre St,2130,445310,"Beer, Wine, and Liquor Stores",44,Retail Trade,4.0,1 to 9,Three Squares,POINT (-71.101572 42.322657),,5,6
42.322885,-71.105355,fernandez beauty & barber shop,335 Centre St,2130,812111,Barber Shops,81,Other Services,4.0,1 to 9,Three Squares,POINT (-71.105355 42.322885),,5,6
42.322918,-71.104366,fellowship church of god,317 Centre St,2130,813110,Religious Organizations,81,Other Services,1.0,1 to 9,Three Squares,POINT (-71.104366 42.322918),,5,6
42.323252,-71.103616,federal foods inc,315 Centre St,2130,311811,Retail Bakeries,31,Manufacturing,6.0,1 to 9,Three Squares,POINT (-71.103616 42.323252),,5,6
42.322023,-71.108908,fat rams pumpkin tattoo,374 Centre St,2130,812199,Other Personal Care Services,81,Other Services,6.0,1 to 9,Three Squares,POINT (-71.108908 42.322023),,5,6
42.320471,-71.110485,family indepdendent,418 Centre St,2130,624190,Other Individual and Family Services,62,Healthcare and Social Assistance,8.0,1 to 9,Three Squares,POINT (-71.110485 42.320471),,5,6
42.323677,-71.100662,family exchange inc,964 Parker St,2130,813319,Other Social Advocacy Organizations,81,Other Services,9.0,1 to 9,Three Squares,POINT (-71.100662 42.323677),,5,6
42.323252,-71.103616,expressions,315 Centre St,2130,448140,Family Clothing Stores,44,Retail Trade,5.0,1 to 9,Three Squares,POINT (-71.103616 42.323252),,5,6
42.322782,-71.102675,evelyn's market,298 Centre St,2130,445110,Supermarkets and Other Grocery (except Convenience) Stores,44,Retail Trade,6.0,1 to 9,Three Squares,POINT (-71.102675 42.322782),,5,6
42.322391,-71.109116,ethiopian cafe,377 Centre St,2130,722511,Full-Service Restaurants,72,Accommodation and Food Services,8.0,1 to 9,Three Squares,POINT (-71.109116 42.322391),,5,6
42.322535,-71.108644,el patio market,371 Centre St,2130,445120,Convenience Stores,44,Retail Trade,2.0,1 to 9,Three Squares,POINT (-71.108644 42.322535),,5,6
42.320747,-71.110308,el oriental de cuba,414 Centre St,2130,722511,Full-Service Restaurants,72,Accommodation and Food Services,5.0,1 to 9,Three Squares,POINT (-71.110308 42.320747),,5,6
42.322878,-71.10504,edianis market,331 Centre St,2130,445110,Supermarkets and Other Grocery (except Convenience) Stores,44,Retail Trade,2.0,1 to 9,Three Squares,POINT (-71.10504 42.322878),,5,6
42.323252,-71.103616,dunkin',315 Centre St,2130,722515,Snack and Nonalcoholic Beverage Bars,72,Accommodation and Food Services,12.0,10 to 24,Three Squares,POINT (-71.103616 42.323252),,5,6
42.322974,-71.104634,dr computer,319 Centre St,2130,443142,Electronics Stores,44,Retail Trade,3.0,1 to 9,Three Squares,POINT (-71.104634 42.322974),,5,6
42.322885,-71.105355,dorka tax & travel,335 Centre St,2130,561510,Travel Agencies,56,"Adminstrative, Support, Waste Management, and Remediation Services",1.0,1 to 9,Three Squares,POINT (-71.105355 42.322885),,5,6
42.322171,-71.10859,dimension sound,368 Centre St,2130,512240,Sound Recording Studios,51,Information,2.0,1 to 9,Three Squares,POINT (-71.10859 42.322171),,5,6
42.323252,-71.103616,dental,315 Centre St,2130,621210,Offices of Dentists,62,Healthcare and Social Assistance,10.0,10 to 24,Three Squares,POINT (-71.103616 42.323252),,5,6
42.322171,-71.10859,de leon jewelry shop,368 Centre St,2130,448310,Jewelry Stores,44,Retail Trade,2.0,1 to 9,Three Squares,POINT (-71.10859 42.322171),,5,6
42.322804,-71.106298,d'yolanny hair salon,345 Centre St,2130,812112,Beauty Salons,81,Other Services,3.0,1 to 9,Three Squares,POINT (-71.106298 42.322804),,5,6
42.322171,-71.10859,d' friends barber shop,366 Centre St,2130,812111,Barber Shops,81,Other Services,5.0,1 to 9,Three Squares,POINT (-71.10859 42.322171),,5,6
42.322673,-71.103544,cricket wireless authorized retailer,306 Centre St,2130,517312,Wireless Telecommunications Carriers (except Satellite),51,Information,2.0,1 to 9,Three Squares,POINT (-71.103544 42.322673),,5,6
42.322673,-71.103544,cricket wireless,306 Centre St,2130,517312,Wireless Telecommunications Carriers (except Satellite),51,Information,3.0,1 to 9,Three Squares,POINT (-71.103544 42.322673),,5,6
42.322878,-71.10504,codman square market,331 Centre St,2130,445110,Supermarkets and Other Grocery (except Convenience) Stores,44,Retail Trade,2.0,1 to 9,Three Squares,POINT (-71.10504 42.322878),,5,6
42.322974,-71.104634,"christopher kokoras insurance ageny, inc",325A Centre St,2130,524210,Insurance Agencies and Brokerages,52,Finance and Insurance,4.0,1 to 9,Three Squares,POINT (-71.104634 42.322974),,5,6
42.322742,-71.106887,christian science reading room & bookstore,351 Centre St,2130,451211,Book Stores,45,Retail Trade,4.0,1 to 9,Three Squares,POINT (-71.106887 42.322742),,5,6
42.322151,-71.108566,centre tailor shop,366B Centre St,2130,448190,Other Clothing Stores,44,Retail Trade,1.0,1 to 9,Three Squares,POINT (-71.108566 42.322151),,5,6
42.322379,-71.109271,centre street dental center,379 Centre St,2130,621210,Offices of Dentists,62,Healthcare and Social Assistance,5.0,1 to 9,Three Squares,POINT (-71.109271 42.322379),,5,6
42.322631,-71.101096,centre street apartments,270 Centre St,2130,531110,Lessors of Residential Buildings and Dwellings,53,Real Estate Rental and Leasing,5.0,1 to 9,Three Squares,POINT (-71.101096 42.322631),,5,6
42.322572,-71.108866,centre nails,373 Centre St,2130,812113,Nail Salons,81,Other Services,2.0,1 to 9,Three Squares,POINT (-71.108866 42.322572),,5,6
42.322217,-71.1097,centre liquor,387 Centre St,2130,445310,"Beer, Wine, and Liquor Stores",44,Retail Trade,4.0,1 to 9,Three Squares,POINT (-71.1097 42.322217),,5,6
42.322199,-71.107796,centre fashion,362 Centre St,2130,448140,Family Clothing Stores,44,Retail Trade,3.0,1 to 9,Three Squares,POINT (-71.107796 42.322199),,5,6
42.322379,-71.109271,centre boutique/childrens shop,379 Centre St,2130,448140,Family Clothing Stores,44,Retail Trade,3.0,1 to 9,Three Squares,POINT (-71.109271 42.322379),,5,6
42.322572,-71.108866,center for labor education,375 Centre St,2130,813930,Labor Unions and Similar Labor Organizations,81,Other Services,4.0,1 to 9,Three Squares,POINT (-71.108866 42.322572),,5,6
42.322447,-71.108772,captain nemo's,367 Centre St,2130,722511,Full-Service Restaurants,72,Accommodation and Food Services,2.0,1 to 9,Three Squares,POINT (-71.108772 42.322447),,5,6
42.322709,-71.103407,cappys pizza,304 Centre St,2130,722511,Full-Service Restaurants,72,Accommodation and Food Services,3.0,1 to 9,Three Squares,POINT (-71.103407 42.322709),,5,6
42.322657,-71.101572,camilo market inc,280 Centre St,2130,445110,Supermarkets and Other Grocery (except Convenience) Stores,44,Retail Trade,2.0,1 to 9,Three Squares,POINT (-71.101572 42.322657),,5,6
42.321955,-71.109278,brendan behan pub,378 Centre St,2130,722511,Full-Service Restaurants,72,Accommodation and Food Services,5.0,1 to 9,Three Squares,POINT (-71.109278 42.321955),,5,6
42.323387,-71.101242,boston housing authority,277 Centre St,2130,531311,Residential Property Managers,53,Real Estate Rental and Leasing,6.0,1 to 9,Three Squares,POINT (-71.101242 42.323387),,5,6
42.321643,-71.109678,boston gulin center inc,390 Centre St,2130,611710,Educational Support Services,61,Educational Services,4.0,1 to 9,Three Squares,POINT (-71.109678 42.321643),,5,6
42.322572,-71.108866,boost mobile premier,373 Centre St,2130,517312,Wireless Telecommunications Carriers (except Satellite),51,Information,4.0,1 to 9,Three Squares,POINT (-71.108866 42.322572),,5,6
42.322885,-71.105355,bocalise llc,335 Centre St,2130,485310,Taxi Service,48,Transportation and Warehosuing,2.0,1 to 9,Three Squares,POINT (-71.105355 42.322885),,5,6
42.322226,-71.1097,blue nile inc,389 Centre St,2130,722511,Full-Service Restaurants,72,Accommodation and Food Services,8.0,1 to 9,Three Squares,POINT (-71.1097 42.322226),,5,6
42.32266,-71.108252,bilt rite construction,365 Centre St,2130,236115,New Single-Family Housing Construction (except For-Sale Builders),23,Construction,5.0,1 to 9,Three Squares,POINT (-71.108252 42.32266),,5,6
42.321532,-71.110274,beauty master plus salon,395 Centre St,2130,812112,Beauty Salons,81,Other Services,3.0,1 to 9,Three Squares,POINT (-71.110274 42.321532),,5,6
42.322258,-71.109741,beauty master,397 Centre St,2130,812112,Beauty Salons,81,Other Services,1.0,1 to 9,Three Squares,POINT (-71.109741 42.322258),,5,6
